{
  "schema_version": "0.1.0",
  "checkpoint_id": "<PRIVATE-CHECKPOINT-ID-FROM-SEALED-BINDING>",
  "checkpoint_type": "qualification_bundle_downloaded",
  "checkpoint_nonce": "<PRIVATE-CHECKPOINT-NONCE-FROM-SEALED-BINDING>",
  "run_id": "RUN-T07-L2M-MANUAL-CONSOLE-HOST-QUALIFICATION-0001",
  "decision_alias": "<DECISION-ALIAS-FROM-PLAN>",
  "marker_alias": "<MARKER-ALIAS-FROM-PLAN>",
  "observed_at_utc": "<CURRENT-UTC-TIMESTAMP-Z>",
  "actor": "user",
  "action_confirmed": true,
  "details": {
    "qualification_bundle_downloaded": true,
    "qualification_archive_sha256": "<SHA256-OF-DOWNLOADED-EVIDENCE-ARCHIVE>"
  }
}
