{
  "schema_version": "0.1.0",
  "checkpoint_id": "<PRIVATE-CHECKPOINT-ID-FROM-SEALED-BINDING>",
  "checkpoint_type": "launch_wizard_image_offered",
  "checkpoint_nonce": "<PRIVATE-CHECKPOINT-NONCE-FROM-SEALED-BINDING>",
  "run_id": "RUN-T07-L2M-MANUAL-CONSOLE-HOST-QUALIFICATION-0001",
  "decision_alias": "<DECISION-ALIAS-FROM-PLAN>",
  "marker_alias": "<MARKER-ALIAS-FROM-PLAN>",
  "observed_at_utc": "<CURRENT-UTC-TIMESTAMP-Z>",
  "actor": "user",
  "action_confirmed": true,
  "details": {
    "launch_wizard_image_offered": true,
    "selected_instance_type": "gpu_1x_a10",
    "selected_region": "us-east-1",
    "selected_image_alias": "img-0032",
    "selected_image_version": "22.4.5-2141"
  }
}
